{
  "version": "kirchhoff-electrical-assessment/1.0",
  "candidate_ir_sha256": "0000000000000000000000000000000000000000000000000000000000000000",
  "audit_sha256": "0000000000000000000000000000000000000000000000000000000000000000",
  "verdict": "pass",
  "summary": "填写第一性原理与工程合理性审查结论；不得因未识别出常见 motif 而报错。",
  "claims": []
}
